comment,author,num_likes,rate
심형래랑 같이 회의실에 있던 외국인들은 회의 끝나고 담배 겁나게 폈을것 같다 ㅋㅋㅋㅋ,Jung Hwan Shin,4,7.37883186340332
진짜 극장에서 이걸 본사람으로써 보면서도 이게 뭐지? 뭔 개똥같은 전개지? 하면서 같이 간 사람에게 너무 미안했어요. 부끄럽고...ㅋㅋㅋㅋ 다시 보느라 고생하셧어요.,홍성균,7,2.537015914916992
아니 ㅋㅋㅋ 영화보다 이게 더 재밋으면 어떻해 ㅋㅋㅋㅋ,ggxxslash1,3,5.38101863861084
저 영화 상영할 때 12살 이었음. 부모님이 요즘 인기 많다고 같이 보러가자고 했는데 무한도전 본다고 끝까지 안 간다고 했음. 그래서 나만 놔두고 가족들은 다 보러감. 그때 나의 통찰력 리스펙,K B,7,7.458086013793945
초월적인 영역이라니 진정 초월한 고수가 되면 초식의 틀에서 벗어나는건가요!,spear West,3,8.928875923156738
저때 친구가 보러가자해서 나왔을때 둘다 멋쩍게 말없이 걸어나오면서 어...그래 마지막 전투씬은 쩔더라 ... 어...그래.. 던게 생각이나네요 둘다 속으론 아이고 내돈....,황민철,4,1.1761724948883057
극한직업이 따로없네요...;; 7망작 리뷰를 위해 저 똥같은 영화들을 여러번 돌려봤을 라이너님의 고통에 묵념....ㅠㅠ,까마귀,4,4.024587154388428
불쌍한 영구형,XX,4,3.481724977493286
이게 뭐라고 2부까짘ㅋㅋㅋ,박건우,3,3.762681245803833
"난 영화 평론가가 좋은 시나리오나 영화를 만들었다는 얘기를 들어본 적이 없다. 영화를 비평하고 까기는 쉽다. 그건 유치원생도 할 수 있으니까 말이다.  하지만 그 영화가 엉터리라도, 한 편의 영화를 만들기는 무척 어렵다. 물론, 심형래 감독이 부족했던 점이 많다는 것은 인정한다. 하지만 그가 주변의 무시와 폄하를 극복하고, 개그맨으로서 한 편의 영화를 완성했다는 것은 평가할 만하다.  당신들이 한 편의 영화를 까기 전에, 우선 엉터리라도 한 편의 극장용 장편 시나리오를 완성해 보라고 말하고 싶다. 아마 대부분은 며칠 못 가서 두 손 두 발 다 들고 말 것이다.  인풋과 아웃풋은 다른 차원의 문제다. 안다고 해서, 모두 행할 수 있는 것이 아니기 때문이다. 중요한 것은 명작을 만드는 것이 아니라 시도하는 것이다.  평생 아무런 결과물도 만들어내지 못하는 사람들이 대부분이다. 시도조차 안 하는 사람들이 대부분이기 때문이다. 심형래 감독이 차라리 이 영화를 찍지 않고,  그 돈으로  부동산 투자를 했다면 오히려 떼돈을 벌었을 것이다.  하지만 그는 적어도 시도했다. 그리고 자신만의 결과물을 만들어냈다. 모두 그의 영화를 욕할지라도, 그는 세상에 결과물을 만들어 놓았다.  아무것도 하지 않는 자들은, 실패나 욕을 먹지도 않지만, 세상에 자취를 남기지도 못한다. 또한 세상에 아무런 영향도 미치지 못한다. 심형래 감독은 시도하고 결과물을 내놓았으며, 세상에 자신의 자취를 남겼다.",빅나(vicna),3,0.703931987285614
"대한민국 문화, 특히 영상 콘텐츠에 대한 담론을 말하는데 최근 조선구마사와 중국에 대한 이야기가, 또 생각이 궁금한데, 다뤄주실 수 있는지 궁금하네요",jsyun9496,4,6.653323173522949
마지막 아리랑 BGM없이.....반전 😱,RIYO ITO,3,6.52490758895874
"요약: 개노잼 보면 시간,돈,멘탈 삼위일체로 날리는 희대의 졸작..",유기농현미밥,4,1.3013055324554443
헐리웃 대스타였던 숀코네리도 반지의 제왕 스토리라인을 이해할수 없다고 간달프역을 안 맡기도 했으니 뭐 판타지물을 싫어하면 이해안될수도 있죠 뭐 그건,청개구리,3,6.01829719543457
너무 심하거나 예민하게 말한 것 같은 사람은 이 영화를 안본 사람이다... 단 한 번만 봐도 느끼는 것들이라....,전성진,3,2.982599973678589
솔직히 캣츠나 다세포소녀보고 보면 명작임ㅋㅋㅋ,엘리사 구독해주세요,9,3.1662938594818115
OBS에서 심형래 단독인터뷰하면서 디워2 포스터공개했네요... ㅋㅋ,징덕,3,3.2903850078582764
진짜 디워 완벽정리하고 완벽한 교훈까지 👍,이시제,5,7.334699630737305
그래도 이 영화라 부르기 민망한 영상물덕에 아리랑이 한국노래라는걸 널리알린 공로가 있지 않을까?,DG Han,3,5.870444297790527
디워는 분명 괜찮은 소재입니다. 본질적으로 스토리의 짜임세가 마이클베이의 트랜스 포머처럼 좀 판에 박힌 스토리가 되겠지만 분명 눈뽕은 있었을거고 보는 맛은 있었을겁니다. 하지만 심형래 감독은 그걸 실패했습니다. 애당초 스토리의 깊이는 바라지도 않았어요. 그저 스토리가 순서대로 진행되고 괴수들이 나오고 조력자의 도움으로 일시적으로 물리치고 목표하는 장소로 가면 되는 아주 전형적인 액션영화였을겁니다. 스토리도 습격 격퇴 자료습득 이동 습격격퇴의 반복이니 어려울거도 없습니다. 근데 이걸 망해요. 진짜 국밥마냥 시원하게 말아드셨어요. 이야기의 기승전결에서 기와 결 외에는 아무것도 없습니다.,Elder sign,3,3.5606908798217773
분명히 영화관에서 본 영환데 마치 지금 처음 보는 것 같고 유일하게 기억에 남는 부분이라곤 아리랑 뿐.......,쿠키오레오,10,3.815767288208008
라이너님 유주얼 서스펙트나 미스트 같은 명작 반전물 리뷰도 좀 해주시리라 믿습니다~,Bryce Kim,5,8.535630226135254
"유주얼 서스펙트, 프라이멀 피어, 파이트 클럽, 메멘토, 미스트 등등 명작 반전물이 참 많은데 이런 반전물 리뷰좀 해주세요!",Bryce Kim,11,6.089031219482422
"디워가 7대망작까지 들어가는지는.,....그냥 흔한 팝콘무비정도라고 봐요",좀비,6,2.1878786087036133
디워만큼은 아니지만 명량도 절대 천만영화감 아닌데 이순신이라는 치트키때문에 천만 찍었다고 생각함,허우성정,54,6.09141206741333
라이너가 ㅁ뭔뜻이냐,golden Sawyer,5,7.19116735458374
그냥재미로 보는거잖아 이샠야,golden Sawyer,6,6.4074530601501465
댓글 지우지마라,golden Sawyer,4,2.52726411819458
뭐 물론 니생각을 올리는거지만 대다수가 너의생각에 동조하는건 아닌거란라는걸 알아라.,golden Sawyer,5,4.124390125274658
명량때 또다시 국뽕으로 흥행했고 국뽕으로 비판을 욕했습니다 국뽕 나쁘다고 생각하지는 않지만 과하지 않았으면 좋겠습니다,아리마,27,6.751333236694336
책에 대한 광고가 너무 널부러져 보이네요 임팩트 있는 다른 방법이었으면 책도 리뷰도 더 기억에 남지 않았을까.. 제 생각입니다.,G.S Lee,5,6.3973493576049805
스토리 진행시켜 ㅋㅋㅋㅋㅋ,조승현,11,6.3980255126953125
발음도잘않되는 ㅋㅋ,golden Sawyer,3,7.87303352355957
아리스토텔레스 정면으로 뚫어버리고 키스갈겨서 부라퀴 주기는 영화,해진이,10,5.337228775024414
유 다이 ㅋㅋㅋㅋㅋ아 웃겨 ㅋㅋㅋ,younggun lee,5,5.242799282073975
상영 당시 마지막 아리랑이 흘러나올 때 극장 안의 사람들은 오열을 했고 &#39;그 자막&#39; 이 흘러나올 때 다같이 박수를 쳤다.....진짜로......그때는 코로나가 아니라 국뽕로나에 다들 감염 되었던 듯 하다...,메이거스,16,8.069869995117188
"생각해보면 조선시대의 전설의 선한 이무기와 악한 이무기, 먼저 여의주를 먹는 이무기가 전설의 용이 되어 승천한다, 그 여의주를 품고 있는 소녀, 그 소녀를 사랑하며 소녀와 여의주를 모두 지키고픈 소년. 시간이 지나 현대에 환생한 소년과 소녀가 도심에서 거대 이무기 괴수와 대결하는 이야기.  감독만 잘 만났으면 명작은 아니어도 평작은 될 수 있을 만한 시놉시스이다. 한국의 이무기와 용에 대한 전설. 그것을 자연스럽게 미국인으로 환생하여 헐리우드에서 펼쳐지는 SF 액션. 비슷한 맥락의 스토리로 &#39;전우치&#39; 가 있지. 명작은 아니어도 킬링타임용 평작은 충분히 될 만한 작품이었다.  이걸......이렇게 만든게 명감독인 증거.",메이거스,5,5.807910442352295
아아... 나는 어째서 이 영상이 끝날 때 당연히 아리랑이 나올 거라고 생각했을까?,blake J,77,4.969339370727539
아주 그냥 뼈를 때리네용ㅋㅋㅋ..심형래 이 영상 보면 거품물고 쓰러질듯ㅋㅋ,KON RI,3,3.700796365737915
이든역 배우 잘생겼고 인물도 훤칠한데...이딴 똥작품에 이미지 같이 추락해서 눈물나네 아효ㅠㅠㅠㅠ,강아지귀여운강아지,3,1.2046754360198975
야식타임이구나~,아라달,7,3.1779134273529053
엄복동도 리부트 해줘여,아링세트나,14,6.224053382873535
예전에 극장서 볼때 기대값이 크지 않아서인지 그렇게 나쁘지만은 않았고 대충 이무기가 이렇게 싸워서 평화가 왔다 이정도로는 이해가 가던데...아동영화수준? 디테일하게 짚고 넘어간다면 머 도찐개찐.....  800만이면 볼사람 안볼사람 거의 다 봤다고 볼수있고....그땐 잼있게 까지는 아니지만 머 그럭저럭 봐놓구선 지금 기준으로 쪽팔리고 수준낮고 쓰레기고 머 그렇게 얘기하면서 나는 영화보는 눈이 달라 이렇게 자위하고 싶은게 아닌지... 그리고 감독의 도덕성으로 영화를 평가한다는건 어떻게 보면 전혀 다른 얘기가 아닐까? 홍상수 감독 작품 얘기하면서 불륜이며 조강지처며 얘기하지는 않을텐데... 머 개인사와 임금체불이나 갑질이 다르다고 한다면 기준을 어디다 두느냐의 차이인거고....  예전에는 디워 욕하면 디워빠들이 난리를 쳤는데 지금와서 바뀐건 디워 잼있게 봤다고하면 영화보는 수준이 낮다고 욕들을까봐 아닥하고 침묵하는정도? 머 그런 느낌... 그냥 그렇다구요...,v Boss,3,7.485361576080322
스토리의 DIY라는 신장르를 개척하셨던 걸까,아링세트나,18,6.726914405822754
리뷰 잘 봤습니다  수고하셨습니다 혹시나 기회가 되신다면 7대 망작 외전으로  &#39;라스트 갓파더&#39;도 한 번 부탁드려봅니다  (참고로 저는 가족들 졸라서  라스트 갓파더를 극장에서 봤고 그 이후로 &#39;어벤저스:엔드게임&#39; 나왔을 때까지  가족들에게 무슨 영화 보자고 이야기를 못 꺼냈습니다...),YM Kim,3,2.180878162384033
반지의 제왕처럼 9시간짜리 영화를 두시간으로 줄이느라 빠진 내용이 많은 걸꺼에요.,Myoung Kim,5,6.503443717956543
알면서도 왜 그럼에도 불구하고 흥행은 되었는가를 봤을때 모든 분석이 와닿습니다.  그리고 한가지 더 추가해 보자면...어린이 영화로 단련된 세대들이 있어요. ㅋㅋ 심형래 영화가 개연성 없고 그냥 그 어릴 때 보던 그 화법 그대로 입니다.  변화 없이 CG만 조금씩 나아진것들...그래서 그냥 이해하고 넘어가고 라는 식인거고  더불어 하도 사회에서 떠들고 하니 궁금해서 보러 갔다가... 어떻게 800만....ㅋㅋㅋㅋ,panic,26,8.047135353088379
1편에서 최대한 긍정적으로 본다고 하다가 2부에서는 정상적인 사고로 리뷰하는 일관성 없는 리뷰. 그리고 오랜 경력의 유튜브 최고의 영화 리뷰어조차 그렇게 일관성없게 만들어버리는 디워의 위대성.,김대원,3,1.736910104751587
"fbi는 미 법무부 소속입니다... 내란같은 국가안보에 위협이 되는 요소를 수사하는 기관이기도 해서 뭐.... 얼추 말은 될거 같습니다....만, 심감독님이 이걸 알고 하는지 아닌지 모르겠다",미즑이냥,7,6.772868633270264
반지의 제왕을 자기 영화보다 아래로 보다니... 자신의 능력을 어마어마 하게 과대평가 하는구나.... 자존감 대박이네 방송나와서 불쌍한척 하면서 영화 찍고 싶은거 티 많이 내던데......,김나영,6,2.62365460395813
날 믿어요? 내 20번째 생일이에요! ㅋㅋㅋㅋㅋㅋㅋㅋㅋㅋㅋㅋㅋㅋㅋㅋㅋㅋ 그만큼 헛소리라는거짘ㅋㅋㅋㅋㅋㅋ 이 영화전체를 아우르는 대화라고 생각함ㅋ,김주성,6,8.290936470031738
고질라 vs. 콩 리뷰해줄거죠?ㅋㅋㅋ 🦖 vs. 🦍,쭈꾸미,13,3.153836727142334
디워의 브루스가 최근 경찰 미드 브루클린 나인나인에서 나온 배우라 괜히 반갑네요 ㅋㅋㅋㅋㅋㅋ,H R,14,5.5912699699401855
이 영화가 미국쪽에 남긴 유일한 유산은 고질라 vs 콩에서 부라퀴를 닮은 뱀 괴수가 나온 거. . .인줄 알았지만 2000년대 미국 고질라 애니에 나왔던 괴수였답니다.,민성재,31,6.228938102722168
디워 이후로도 아무것도 느끼지 못한 것 같이 그냥 컨텐츠를 소모하면서 영화한테 뭘 바래? 라는 식의 시청자는 아직도 수두룩합니다,c d,31,1.6407307386398315
라이너님 영상 중에 역대 제일 웃기네요 ㅋㅋㅋㅋㅋㅋㅋㅋㅋㅋㅋㅋㅋㅋㅋㅋㅋㅋ 30분 내내 웃었네,lliliilili lliiilili,4,8.357213973999023
디워를 한국 영화에서의 국뽕 부작용 예방주사로 의미를 부여해준 것은 라이너의 아량,Robert Carlyle,3,6.329156398773193
이렇게 진지한 리뷰를...감사합니다.^^,전원재,9,6.223257541656494
코미디언 심형래 : 웃기네 영화감독 심형래 : 웃기네,lem mono,26,3.1706392765045166
아직도 고통받는 허영무...,야타제,19,4.697509765625
역시 심형래는 최고의 코미디언 ㅋㅋㅋ,윤강,3,8.48486614227295
"당시 CG업계쪽에서 심형래라면 아주 치를 떨었다고 하더군요. 자기 직원들 임금체불도 문제였지만 다른 업체에서 장비를 임대해와서는 기한이 지났는데도 안돌려주고 임대료 못주겠다고 어디 대심형래한테 돈을 받으려고하냐고 인성질,갑질 했었다고 하더라구요. TV를 통해서 만들어진 좋은 이미지에 다들 속았던거죠. 그래서 저는 심감독은 희대의 사기꾼이었다고 생각합니다.",heonseo lee,35,1.7009403705596924
멍청한 대중들은 선동을 참 잘당한다.ㅋㅋ저당시에 디워같은 영화를 왜보나 싶었다ㅋ 이미지메이킹이 이래서 중요하지 ㅋㅋㅋ,Na Mu,4,4.293356418609619
진짜로 그 당시에 세상이 미쳤다고 생각했음..,kj k,20,7.506262302398682
2부 재생시간이 30분이 넘어가네 ㅋㅋㅋㅋㅋㅋㅋㅋㅋ수고하셨습니다,꽁치왕,20,5.530529499053955
이든 역할의 제이슨 베어라는 배우... 잘생겼는데 저 이후로 활동이 하나도 없더군요,흑랑,7,4.641011714935303
"그냥 딱봐도 심형래 감독이 찍고 싶어하는 장면을 위해 영화를 만든 거 같습니다. 그러다보니 스토리 연결도 안되고, 고증도 엉망이고 그런 모순들이 터져 나오는 거죠.",유튭 시청자,20,2.316574811935425
"인생에서 제일 떠올리기 싫은 기억들 중 하나 : 디워, 라스트 갓파더 극장에서 본 기억...어른들이 영화관에 친척들하고 같이 구겨넣고 놀러가신....",시가는쿠바산,6,2.2656524181365967
오~ 세라 친구로 나오는 배우 에이미 가르시아네요 드라마 루시퍼에 나오는데~ 드라마나 영화 경력이 많은 배우인데 이런 영화에 나왔었네요.....,김나영,14,4.677809715270996
디워 군대에서 토요일날 낮에 ocn에서 봄,Sean-Neal Jeaux,5,1.9832730293273926
마지막에 아리랑이 울려퍼질때 눈물이 나더라고요... 돈이 아까워서,김남효,11,3.694843053817749
라이너님의  대단한 용기에 감탄합니다  그 전설의 망작  디~~워 를 리뷰 하시느라 고생하셨습니다  역시 라이너님의 망작 리뷰 재미있게 보고 갑니다,루나마리안,4,6.8804612159729
진중권 보일 때마다 흠칫,정훈,6,5.390537261962891
이과충으로서 말씀드리자면 다이아몬드 부분은 좀 억까십니다,corvo kim,6,8.108552932739258
중간중간 잭이랑 이든 헷갈리신 대본 몇 부분 있으신듯 . 동물원 아저씨도 코끼리를 봤다고 쓰여져있는데 그것도 코끼리가 아니라 뱀 아닌지용 항상 잘보고 있어용,SXPO,9,5.887781143188477
술 마시는 걸로는 태클 못 거는게... 10대 때부터 술 마시는 애들 개많은데다 저긴 술집에서 신분증 검사 같은 걸 하는 것도 아니라서...;;,Corpse Cannibal,9,5.392974376678467
디워이거 누가 다시 못만드나,초이데이,13,3.2207295894622803
성인이되고 처음으로 심야 영화로 이걸 봤고... 저도 울고 친구도 울고 부라퀴도 울었었죠.,노바슈퍼,9,8.958590507507324
여러분이 이든이였다면 어떤 선택을 할까요 . 제가 이든이였다면 디워에 출연 안합니다,공공의떡,3,2.6550588607788086
영화보다 리뷰가 더 재밌는 영화...,Zero.S_TV,34,5.8618974685668945
쉴드를 치는건지 쉴드로 치는건지 ㅋㅋㅋㅋㅋ,JuneU,140,3.5251290798187256
국민학교 시절 심형래의 우뢰매를 재밌게  본 사람입장에서...    그런 류의  초딩 작품에... 너무 진지하게 비판하는게 좀 웃긴느낌입니다... 관점을 굳이 진지하게 볼 필요가 있을까요? 요즘 초딩 수준이 어떤진 잘 모르겠지만.... 저만하면 초딩이 보기엔 그럭적일거 같은데... 너무 성인영화로 보는게 문제인게 아닌가 싶습니다.   우뢰매를 보면서 이렇게 진지하게 비판하진 않잔아요.  비판하는 재미로 하는건 이해는 가지만요,마스터조,3,5.496527194976807
심각독님은 다 계획이 있구나?,첸씨,12,7.7238450050354
솔직히 이무기라고 나온 뱀도 개구림 서양식 드래곤도 아니고 동양식 용도 아니고 코브라 처럼 생긴것도 아니고 이도저도 아님,이지석,9,1.9013633728027344
와 2부도 있네요,park Er,5,6.512269020080566
저 아직 이거 안봤는데  님께서 안볼 수 있는 이유를 정확히 제시해 주셨네요! ^^,태공망,3,7.642182350158691
심형래 영화 지인이랑 보면 다 손절하는거같은데 맞나요? 저는 중딩때 라스트갓파더 친구랑 보고 그날 이후로 연락이 안되던데요..,천재유익병,4,1.8809565305709839
이거 개봉했을 때 중2이었는데... 아무것도 모르던 그 때는 그냥 개쩌는 영화라고 생각하고 재미있게 봤었는데 역시 중2는.... ㅠㅠㅠㅠ 왜 그랬던 것이냐 그 시절의 나 ㅠㅠ,박박,14,8.9689302444458
라이너님. 이참에 망작 리뷰 끝나면 망작들도 11개 정도 추려서 철학시사회 속편 만들어보는 건 어때요? ㅋㅋ,김민성,3,1.8648079633712769
라스트갓파더는 어찌하시련지,박서의,4,6.152657985687256
리뷰 잘 봤습니다~,시아,9,4.702080726623535
심형래 진짜 다시는 영화 만들지 마라. 한번만더 영화 만들었다가는. 진짜 테러로 고소 당하는 수가 있다.,gldrv ghkliox,9,1.6443686485290527
차라리 이거 만들 돈으로 메이플 스토리 ds스토리를 고퀼로 애니화하는게 100배는 잘 먹힐 듯,j j,7,2.1549088954925537
여친과 봤던 영화.. 디 워.... 그녀는 지금 잘 살고 있을까... ㅠㅠ,권형근,24,8.436372756958008
심형래의 어린이 영화 형식의 영화구성이 문제지 몬스터는 좋았음,정일지,8,4.16932487487793
아리랑 아리랑 아라리요~ 극장에서 이 부분을 듣는 순간 위쪽을 보며 알수없는 오묘한 기분을 느꼈습니다,박서의,37,8.640185356140137
라이너님 지금 잭 스나이더의 저스티스 리그랑 고질라 vs 콩 등등 리뷰할 것들 참 많이 있습니다 다 해주시리라 믿습니다!ㅎㅎ,rechup tv,28,7.638627052307129
드디어 7대 망작 마무리가 시작된다!! 디워,영화보기,10,2.3175647258758545
"아, 드뎌 하고 눌렀는데 뭐요? 20시?!  우린 과거 영화를 한 중반까지 볼 때 드라칸이 부라퀴의 폴리모프인가 하는 생각까지 했어. 무슨 100미터짜리 뱀이 도시를 헤집다가 갑자기 어디론가 사라지는데, 상식적으로 몸집이 작아진다고 생각 않아겠냐고.  잭이 3명의 남자를 제압하고 퇴장할 때 자세가 왜 저래? 얼굴을 앞으로 내밀고 옆으로 이동하네?  잭은 이든을 믿지 않았던 거네. 그러니까 저런 폭탄을 목에 걸어주고 적진에 잡혀가면 그때 폭발하게 설정해둔 거였어. 근데 이든은 왜 잡아간거야? 그자리에서 조지든지 그냥 두고 와도 되잖아?  국뽕... 제3제국 때의 독일인들은 충성심과 애국심이 없었겠나?",༺ৡ 대사제 ৡ༻,6,7.132587432861328
영화 만들려고 투자받은 돈으로 리무진 택시타고 도박장에서 거의 다 날리고 무슨 장난감 권총으로 직원들을 쏘고 갑질했다죠?,스타베리Enoch,45,0.9329029321670532
